{
  "schema": 3,
  "revision": 3,
  "updatedAt": "2026-08-26T01:00:00.000Z",
  "updatedBy": "7c1e4b2a-0d3f-4a7e-9b1c-2f5e8d6a4c10",
  "workflows": [
    {
      "id": "01J9ABCDEF0123456789ABCDEF",
      "name": "회의",
      "updatedAt": "2026-08-26T01:00:00.000Z",
      "minDurationSec": 30,
      "steps": [
        { "id": "up", "type": "drive.upload", "folder": "recly/{{yyyy}}/{{yyyy}}-{{MM}}" },
        { "id": "hook", "type": "webhook", "url": "https://n8n.example.com/webhook/rec", "secretRef": "hook_main",
          "retry": { "maxAttempts": 10, "initialDelaySec": 60, "maxDelaySec": 3600 } }
      ]
    },
    {
      "id": "01J9ABCDEF0123456789ABCDEG",
      "name": "메모",
      "updatedAt": "2026-08-20T09:30:00.000Z",
      "steps": [
        { "id": "up", "type": "drive.upload", "folder": "recly/memo/{{yyyy}}-{{MM}}", "includeMeta": true }
      ]
    },
    {
      "id": "01J9ABCDEF0123456789ABCDEH",
      "name": "회의록",
      "updatedAt": "2026-08-29T02:00:00.000Z",
      "minDurationSec": 120,
      "steps": [
        { "id": "up", "type": "drive.upload", "folder": "recly/{{yyyy}}/{{yyyy}}-{{MM}}" },
        { "id": "stt", "type": "transcribe", "provider": "assemblyai", "secretRef": "assemblyai_key",
          "language": "ko", "diarize": true, "speakers": { "min": 2, "max": 6 } }
      ]
    }
  ]
}
